{
  "cases": [
    {
      "assertions": [
        {
          "comparison": "semantic-specification-contract",
          "contract_sha256": "172e7813ebf958555f528032dcb2e5e119b8ed4f4f5d8df71e6d62443843e7da",
          "id": "A01-authored-mini-plans",
          "oracle": null,
          "outcome": "passed",
          "target": [
            {
              "file": "packages/core/test/control-center-surfaces.test.ts",
              "outcome": "passed",
              "title": "reviews agent-authored mini plans with one adaptive Approve or Revise action"
            },
            {
              "file": "packages/core/test/native-run-program.test.ts",
              "outcome": "passed",
              "title": "compiles a coding plan into deterministic tickets and validates a scoped graph mutation"
            }
          ]
        },
        {
          "comparison": "semantic-specification-contract",
          "contract_sha256": "c4c4da853123402a4051204a85d8a9e80d6c730b4cdee75fa66c460e84dad5dd",
          "id": "A02-one-adaptive-action",
          "oracle": null,
          "outcome": "passed",
          "target": [
            {
              "file": "packages/core/test/control-center-surfaces.test.ts",
              "outcome": "passed",
              "title": "reviews agent-authored mini plans with one adaptive Approve or Revise action"
            }
          ]
        },
        {
          "comparison": "semantic-oracle-contract",
          "contract_sha256": "f3b941535f58e1bd77d18b8b7f47d30f89315e11d70b3943c57d6439d6f94868",
          "id": "A03-multiline-revision",
          "oracle": {
            "kind": "rust-test",
            "name": "approval_revision_editor_wraps_steering_and_shows_one_adaptive_action",
            "outcome": "passed"
          },
          "outcome": "passed",
          "target": [
            {
              "file": "packages/core/test/control-center-surfaces.test.ts",
              "outcome": "passed",
              "title": "submits multiline plan steering and returns review to visible planning without approval"
            }
          ]
        }
      ],
      "id": "KPAR-TUI-0003",
      "outcome": "passing"
    }
  ],
  "isolation": {
    "live_projects": false,
    "provider_calls": 0,
    "temporary_pi_homes": true,
    "temporary_projects": true
  },
  "normalization": "koni.parity-normalization.v2",
  "oracle": {
    "commit": "fcc425e51114bcedb9aeae44d6e8c8418a525e6b",
    "semantic_suite_sha256": "a675ad85b1834a113c98a4f33740c77f9bfa0f119a5873e324931ded2bb4c46a"
  },
  "protocol": "koni.typescript-parity-capture.v1",
  "schema_version": "1.0",
  "capture_sha256": "22b84c8f381e6c8219f306b54734c9f019c43e8bd6e5fab1dd89859a8df985df"
}
