{
  "cases": [
    {
      "assertions": [
        {
          "comparison": "semantic-oracle-contract",
          "contract_sha256": "4ca1b9f08e822e13323f15fe84221edccbf428e725778ef9f3febc88c500a340",
          "id": "A01-exactly-once",
          "oracle": {
            "kind": "rust-test",
            "name": "every_fsynced_publication_boundary_recovers_and_retries_idempotently",
            "outcome": "passed"
          },
          "outcome": "passed",
          "target": [
            {
              "file": "packages/core/test/file-journal.test.ts",
              "outcome": "passed",
              "title": "publishes a prepared multi-file transaction and replays commit idempotently"
            },
            {
              "file": "packages/core/test/isolated-git-lifecycle.test.ts",
              "outcome": "passed",
              "title": "recovers crash-forward approval and publication intents from exact state"
            },
            {
              "file": "packages/core/test/isolated-git-lifecycle.test.ts",
              "outcome": "passed",
              "title": "records failed publication compensation as a forward commit and recovers it exactly once"
            }
          ]
        },
        {
          "comparison": "semantic-oracle-contract",
          "contract_sha256": "d4a954397521668ce8fac496b1941a28b6b7797d70ac3a9cca89af2e00007481",
          "id": "A02-forward-rollback",
          "oracle": {
            "kind": "rust-test",
            "name": "catalog_forward_rollback_archives_causal_work_and_preserves_later_unrelated_state",
            "outcome": "passed"
          },
          "outcome": "passed",
          "target": [
            {
              "file": "packages/core/test/isolated-git-lifecycle.test.ts",
              "outcome": "passed",
              "title": "records failed publication compensation as a forward commit and recovers it exactly once"
            },
            {
              "file": "packages/core/test/isolated-git-lifecycle.test.ts",
              "outcome": "passed",
              "title": "preserves ambiguous work added after a publication crash instead of resetting it"
            }
          ]
        }
      ],
      "id": "KPAR-RCV-0001",
      "outcome": "passing"
    }
  ],
  "isolation": {
    "live_projects": false,
    "provider_calls": 0,
    "temporary_pi_homes": true,
    "temporary_projects": true
  },
  "normalization": "koni.parity-normalization.v2",
  "oracle": {
    "commit": "fcc425e51114bcedb9aeae44d6e8c8418a525e6b",
    "semantic_suite_sha256": "a675ad85b1834a113c98a4f33740c77f9bfa0f119a5873e324931ded2bb4c46a"
  },
  "protocol": "koni.typescript-parity-capture.v1",
  "schema_version": "1.0",
  "capture_sha256": "74bc11815df2e76fa8e1da526ab60a685d94979f6a5fd98fe747ea4a363b0b70"
}
