{
  "cases": [
    {
      "assertions": [
        {
          "comparison": "semantic-specification-contract",
          "contract_sha256": "d3c3b672ab704c75e09b19dfed1dbd0228cac46fa3a68aa1fdd85e0162c71716",
          "id": "A01-full-transcript",
          "oracle": null,
          "outcome": "passed",
          "target": [
            {
              "file": "packages/core/test/session-transcript.test.ts",
              "outcome": "passed",
              "title": "preserves complete entries and follows the selected path"
            },
            {
              "file": "packages/core/test/control-center-surfaces.test.ts",
              "outcome": "passed",
              "title": "renders the complete native Pi transcript and sends composer text through agent authority"
            }
          ]
        },
        {
          "comparison": "semantic-specification-contract",
          "contract_sha256": "df52e5aeb1a63db19480f668b8b1a86cdddde0f1657084c8b0917c6281e58951",
          "id": "A02-usage-complete",
          "oracle": null,
          "outcome": "passed",
          "target": [
            {
              "file": "packages/core/test/session-transcript.test.ts",
              "outcome": "passed",
              "title": "keeps cache-inclusive and new-token totals separate"
            },
            {
              "file": "packages/core/test/pi-managed-session.test.ts",
              "outcome": "passed",
              "title": "persists the full attempt mapping and accounts for cached and new tokens separately"
            }
          ]
        },
        {
          "comparison": "semantic-specification-contract",
          "contract_sha256": "05aa77734c1e8ce6c8d492db1dd516127304bc24458f135b6df3174682847689",
          "id": "A03-authority-reissued",
          "oracle": null,
          "outcome": "passed",
          "target": [
            {
              "file": "packages/core/test/pi-compaction.test.ts",
              "outcome": "passed",
              "title": "creates structured checkpoints and reissues exact authoritative context"
            },
            {
              "file": "packages/core/test/pi-production-session.test.ts",
              "outcome": "passed",
              "title": "authenticates a launch-bound structured compaction as a safe continuation boundary"
            }
          ]
        },
        {
          "comparison": "semantic-specification-contract",
          "contract_sha256": "b15ec1824473615cf776cf30b4a97403724c25ba17df12cede362a24c0e6b365",
          "id": "A04-linear-attempt",
          "oracle": null,
          "outcome": "passed",
          "target": [
            {
              "file": "packages/core/test/pi-production-session.test.ts",
              "outcome": "passed",
              "title": "creates a fresh persisted linear session without making a provider call"
            },
            {
              "file": "packages/core/test/pi-launch-spec.test.ts",
              "outcome": "passed",
              "title": "hash-binds a parent attempt/session/entry branch without enabling ambient Pi branching"
            }
          ]
        }
      ],
      "id": "KPAR-SES-0001",
      "outcome": "passing"
    }
  ],
  "isolation": {
    "live_projects": false,
    "provider_calls": 0,
    "temporary_pi_homes": true,
    "temporary_projects": true
  },
  "normalization": "koni.parity-normalization.v2",
  "oracle": {
    "commit": "fcc425e51114bcedb9aeae44d6e8c8418a525e6b",
    "semantic_suite_sha256": "a675ad85b1834a113c98a4f33740c77f9bfa0f119a5873e324931ded2bb4c46a"
  },
  "protocol": "koni.typescript-parity-capture.v1",
  "schema_version": "1.0",
  "capture_sha256": "473bc4194ffda5886ce2778f5fcfba841fcbfe823bbcb138e2495a871049e1a3"
}
