{
  "cases": [
    {
      "assertions": [
        {
          "comparison": "semantic-oracle-contract",
          "contract_sha256": "bcd494222107ec1a3334f1ffeee0f30b82f1efcdc6c162eaac828898577ef149",
          "id": "A01-profile-valid",
          "oracle": {
            "kind": "command-capture",
            "name": "install-software",
            "outcome": "passed"
          },
          "outcome": "passed",
          "target": [
            {
              "file": "packages/core/test/profile-install.test.ts",
              "outcome": "passed",
              "title": "materializes a verified profile without changing Pi settings"
            }
          ]
        },
        {
          "comparison": "semantic-specification-contract",
          "contract_sha256": "96352afeeec0c967a0c7e1d9abe5ed28b210d799cc9ae9457b1c023b04a491c7",
          "id": "A02-pi-preserved",
          "oracle": null,
          "outcome": "passed",
          "target": [
            {
              "file": "packages/core/test/profile-install.test.ts",
              "outcome": "passed",
              "title": "materializes a verified profile without changing Pi settings"
            }
          ]
        }
      ],
      "id": "KPAR-CFG-0001",
      "outcome": "passing"
    }
  ],
  "isolation": {
    "live_projects": false,
    "provider_calls": 0,
    "temporary_pi_homes": true,
    "temporary_projects": true
  },
  "normalization": "koni.parity-normalization.v2",
  "oracle": {
    "commit": "fcc425e51114bcedb9aeae44d6e8c8418a525e6b",
    "semantic_suite_sha256": "a675ad85b1834a113c98a4f33740c77f9bfa0f119a5873e324931ded2bb4c46a"
  },
  "protocol": "koni.typescript-parity-capture.v1",
  "schema_version": "1.0",
  "capture_sha256": "f62c71f6a4a22f04cd2c3b0d8375be012674acc63ae4bffb30f47dc27d2214a1"
}
